index,published,topic,term,domain,language,valid,de,title,description,en,la,url,image,archive,content,quote,added,feed,country,ipcc,continent
cf5ac3e224e6bc81ed5defd6477586f1,2026-07-02T11:10:00Z,Earthquake,σεισμός,www.protothema.gr,el,0.7,"Das Richterbeben der Stärke 5,2 auf Karpathos war auch auf dem Dodekanes zu spüren. Wo liegt das Epizentrum des Erdbebens? Erdbeben | Karpathos | Griechenland","Σεισμός 5,2 Ρίχτερ στην Κάρπαθο, έγινε αισθητός στα Δωδεκάνησα",Πού εντοπίζεται το επίκεντρο της σεισμικής δόνησης | Σεισμός | Κάρπαθος | Ελλάδα,"5.2 Richter earthquake in Karpathos, was felt in the Dodecanese. Where is the epicenter of the earthquake? Earthquake | Karpathos | Greece",5.2 Richter terrae motus in Karpatho in Dodecanesi sentitur. Ubi est epicor terrae motus? Terrae motus | Karpathos | Graecia,https://www.protothema.gr/greece/article/1844530/seismos-tora-stin-karpatho/,https://www.protothema.gr/images/640x360share/jpg/files/2026-07-02/seismos-karpathos-mkt.jpg,,"5,2 14:00 .,  11   5,2  13 .
, , .
, .",,2026-07-03 14:59:04+00:00,random,,,
d1ae57e8fef9a77e8f6949734d824ded,2026-07-02T14:36:20Z,Earthquake,σεισμός ελλάδα,www.protothema.gr,el,0.7,"Durch das Richterbeben der Stärke 5,2 auf Karpathos wurden keine Schäden gemeldet, die Feuerwehr ist in erhöhter Alarmbereitschaft. Unmittelbar nach dem Erdbeben wurden Katastrophenschutzkräfte mobilisiert, deren Personal über das gesamte Inselgebiet verteilt war, um Kontrollen durchzuführen | Erdbeben | Erdbeben jetzt | Karpathos | Griechenland","Δεν έχουν αναφερθεί ζημιές από τον σεισμό 5,2 Ρίχτερ στην Κάρπαθο, σε αυξημένη ετοιμότητα η πυροσβεστική","Aμέσως μετά τη δόνηση, κινητοποιήθηκαν οι δυνάμεις Πολιτικής Προστασίας, με διασπορά προσωπικού στην ευρύτερη νησιωτική περιοχή, προκειμένου να πραγματοποιηθούν έλεγχοι | Σεισμός | Σεισμός τώρα | Κάρπαθος | Ελλάδα","No damage has been reported from the 5.2 Richter earthquake in Karpathos, the fire department is on increased alert. Immediately after the earthquake, Civil Protection forces were mobilized, with personnel dispersed throughout the wider island area, in order to carry out checks | Earthquake | Earthquake now | Karpathos | Greece","Nullum detrimentum relatum est ex 5.2 Richter terrae motu in Karpathos, Dicasteria incendia in intenti aucta esse. Statim post terraemotu, Civilis Praesidium copiae convenerunt, cum curatores per latiorem insulam regionem dispersi, ad explendum compescendos | Terrae motus | Terrae motus nunc | Karpathos | Graecia",https://www.protothema.gr/greece/article/1844641/den-ehoun-anaferthei-zimies-apo-ton-seismo-52-rihter-stin-karpatho-se-auximeni-etoimotita-i-purosvestiki/,https://www.protothema.gr/images/640x360share/jpg/files/2026-07-02/seismos-karpathos.jpg,,"To view this video please enable JavaScript, and consider upgrading to a
 web browser that supports HTML5 video",,2026-07-03 14:59:04+00:00,usgs,Greece,MED,Europe
