index,published,topic,term,domain,language,valid,de,title,description,en,la,url,image,archive,content,quote,added,feed,country,ipcc,continent
eddee7592dd8dc6b0ff3b70d0f903bc4,2026-06-01T08:56:29Z,Volcano,ηφαίστειο,www.protothema.gr,el,0.9,"Hawaiis Vulkan Kilauea bricht erneut aus, spektakuläre Bilder von Lavafontänen. Kilauea ist einer der aktivsten Vulkane der Welt und liegt auf der Big Island von Hawaii | Hawaii | Kilauea | Explosion | Welt","Το ηφαίστειο Κιλαουέα στη Χαβάη εξερράγη ξανά, εντυπωσιακές εικόνες με σιντριβάνια λάβας",Το Κιλαουέα συγκαταλέγεται στα πιο ενεργά ηφαίστεια του πλανήτη και βρίσκεται στο Μεγάλο Νησί της Χαβάης | Χαβάη | Κιλαουέα | Έκρηξη | Κόσμος,"Hawaii's Kilauea volcano erupts again, spectacular images of lava fountains. Kilauea is one of the most active volcanoes on the planet and is located on the Big Island of Hawaii | Hawaii | Kilauea | Explosion | World","Volcano Kilauea Hawaii iterum erumpit, spectaculares imagines fontium lavarum. Kilauea una est vulcanorum acerrimi in planeta et in Magna insula Hawaii sita est | Hawaii | Kilauea | Explosion | Mundus",https://www.protothema.gr/world/article/1827753/to-ifaisteio-kilaouea-sti-havai-exerragi-xana-eduposiakes-eikones-me-sidrivania-lavas/,https://www.protothema.gr/images/640x360share/jpg/files/2026-06-01/kilauea-mkt.jpg,,"#Kilauea: Episode 48 precursory activity continues. So far, there have been 22 lava overflows, all from the south vent. Episode 48 Lava Fountaining will likely start today. pic.twitter.com/BGD8gsL6D6… [+37 chars]",,2026-06-03 05:33:35+00:00,random,,,
45c1a6db553dca567af4fe3225231397,2026-06-01T10:16:37Z,Volcano,ηφαίστειο,www.newsit.gr,el,0.9,"Hawaiis Vulkan Kilauea bricht aus – Beeindruckendes Video von Lavaströmen. Der Kilauea-Vulkan auf Hawaii brüllt, als er erneut ausbricht, was einen Alarm in der Region signalisiert. Der Kilauea auf Hawaii ist einer der aktivsten Vulkane ... 
Der Artikel Hawaiis Vulkan Kilauea bricht aus – Beeindruckendes Video zu Lavaströmen veröffentlicht…",Το ηφαίστειο Κιλαουέα στη Χαβάη εξερράγη – Εντυπωσιακά βίντειο με πίδακες λάβας,"Βρυχάται το ηφαίστειο Κιλαουέα στη Χαβάη που εξερράγη εκ νέου σημαίνοντας συναγερμό στην περιοχή. Το Κιλαουέα στην Χαβάη είναι ένα από τα πιο ενεργά ηφαίστεια ... 
To άρθρο Το ηφαίστειο Κιλαουέα στη Χαβάη εξερράγη – Εντυπωσιακά βίντειο με πίδακες λάβας δημοσι…","Hawaii's Kilauea volcano erupts – Impressive video of lava jets. The Kilauea volcano in Hawaii is roaring as it erupted again, signaling an alert in the region. Kilauea in Hawaii is one of the most active volcanoes ... 
The article Hawaii's Kilauea Volcano Erupts – Impressive Lava Jets Video Released…","Kilauea vulcano Hawaii erumpit - video impressivum lavae rumpit. Volcano Kilauea in Hawaii rugiens iterum erupit, significans erectum in regione. Kilauea in Hawaii unus vulcanorum acerrimus est... 
Articulus Hawaii Kilauea Vulcanus erumpit – Impressive Lava Jets Video Privatus…",https://www.newsit.gr/kosmos/to-ifaisteio-kilaouea-sti-xavai-ekserragi-entyposiaka-vinteio-me-pidakes-lavas/4691426/,https://www.newsit.gr/wp-content/uploads/2026/06/kilaouea-grab-1200x630.jpg,,".
 . , ,.
Live , , .
 . , .
#Kilauea: Episode 48 precursory activity continues. So far, there have been 22 lava overflows, all from the south vent. Episode 48 Lava Fountaining will likely start t… [+671 chars]",,2026-06-03 05:33:35+00:00,random,,,
75c51283e420df56f747cd8495e29cb3,2026-06-02T13:56:25Z,Heat Wave,κύμα καύσωνα,www.skai.gr,el,0.9,Frankreich: Das Land erlebte den wärmsten Frühling seit Beginn der Aufzeichnungen „seit Beginn der Aufzeichnungen im Jahr 1900“. Nach Angaben des französischen Wetterdienstes hat das Land gerade eine frühe und intensive Hitzewelle mit beispiellosen Temperaturen in dieser Saison erlebt.,Γαλλία: Η χώρα βίωσε την πιο ζεστή άνοιξη που έχει καταγραφεί ποτέ «από τότε που ξεκίνησαν οι μετρήσεις το 1900»,"H χώρα μόλις αντιμετώπισε ένα πρώιμο και έντονο κύμα καύσωνα, με πρωτόγνωρες για την εποχή θερμοκρασίες, σύμφωνα με τη μετεωρολογική υπηρεσία της Γαλλίας","France: The country experienced its warmest spring on record ""since records began in 1900"". The country has just experienced an early and intense heat wave, with unprecedented temperatures for the season, according to France's meteorological service.","Gallia: terra calidissimum fontem suum expertus est ""cum monumentis anno 1900"" incepit. Patria modo maturam et intensam aestum undam expertus est, inusitatae temperaturae pro tempore, secundum ministerium meteorologicum Franciae.",https://www.skai.gr/news/environment/gallia-i-xora-viose-tin-pio-zesti-anoiksi-pou-exei-katagrafei-pote,https://cdn.skai.gr/sites/default/files/styles/article_16_9/public/feedelio/ap-eiffel-tower-during-a-sunny-day-in-paris.jpg?itok=NtvVWa_S,,"« 1900», , .
« 13,8° , 2026 ( +1,7 , 2011 (+1,5°C) 2020 (+1,3°C)», Météo-France, , , .
 .Skai.gr Google News .",,2026-06-03 20:06:39+00:00,random,,,
