index,published,topic,term,domain,language,valid,de,title,description,en,la,url,image,archive,content,quote,added,feed,country,ipcc,continent
01153d37ae1244c73789bfa6d87ea57f,2026-02-01 00:00:00,Precipitation,έντονη βροχόπτωση,www-topontiki-gr.cdn.ampproject.org,el,0.7,"cloudevo. Zuvor kam es auf Santorini zu heftigen Regenfällen, die zu Überschwemmungen auf den zentralen Straßen der Insel führten.",cloudevo,Έντονη βροχόπτωση σημειώθηκε νωρίτερα στη Σαντορίνη με αποτέλεσμα να πλημμυρήσουν κεντρικοί δρόμοι του νησιού.,"cloudevo. Heavy rain occurred earlier in Santorini, resulting in flooding of the island's central roads.","cloudevo. Imber gravis antea in Santorinis occurrit, ex inundatione viae centralis insulae.",https://www-topontiki-gr.cdn.ampproject.org/v/s/www.topontiki.gr/2026/02/01/santorini-plimmirisan-i-kentriki-dromi-tou-nisiou-megala-provlimata-stis-metakinisis-videos/amp/?amp_js_v=0.1&amp_gsa=1#webview=1,,,,,2026-02-04 13:51:12+00:00,random,,,
caedb37e2ddc3d422fb0511d0a3406ee,2026-02-01 14:45:09,Precipitation,έντονη βροχόπτωση,www-athensvoice-gr.cdn.ampproject.org,el,0.9,Flüsse in den Straßen in Dörfern von Santorini nach dem starken Regen. Nan,Ποτάμια οι δρόμοι σε χωριά της Σαντορίνης μετά την έντονη βροχόπτωση,,Rivers in the streets in villages of Santorini after the heavy rain. nan,Flumina in vicis in pagis Santorini post pluviam. nan,https://www-athensvoice-gr.cdn.ampproject.org/v/s/www.athensvoice.gr/epikairotita/ellada/945183/potamia-oi-dromoi-se-horia-tis-sadorinis-meta-tin-edoni-vrohoptosi/amp/?amp_js_v=0.1&amp_gsa=1#webview=1,,,,,2026-02-04 13:51:12+00:00,random,,,
4f173ae1728d325e019c0c19f54d4aeb,2026-02-01 16:45:42,Storm,καταιγίδα,www-newsbomb-gr.cdn.ampproject.org,el,0.9,"Santorini: Die Straßen in Emporio, Megalochori, Monolitho, Pyrgos und Mesaria sind nach dem Regen überflutet. Der starke Sturm verursachte Überschwemmungen und Verkehrsbehinderungen, ernsthafte Schäden blieben bislang aus","Σαντορίνη:Ποτάμια οι δρόμοι σε Εμπορείο, Μεγαλοχώρι, Μονόλιθο, Πύργο και Μεσαριά μετά την βροχόπτωση","Η ισχυρή καταιγίδα προκάλεσε πλημμύρες και προβλήματα μετακίνησης, χωρίς σοβαρές ζημιές μέχρι στιγμής","Santorini: The roads in Emporio, Megalochori, Monolitho, Pyrgos and Mesaria are flooded after the rain. The strong storm caused flooding and traffic problems, with no serious damage so far","Santorini: Viae Emporio, Megalochori, Monolitho, Pyrgos et Mesaria post pluviam inundantur. Tempestas fortis inundationes et negotiationes difficultates effecit, cum nullo gravi damno tantum",https://www-newsbomb-gr.cdn.ampproject.org/v/s/www.newsbomb.gr/ellada/story/1712355/santorini-potamia-oi-dromoi-se-emporeio-megaloxori-monolitho-pyrgo-kai-mesaria-meta-tin-vroxoptosi/amp?amp_js_v=0.1&amp_gsa=1#webview=1,,,,,2026-02-04 13:51:12+00:00,random,,,
ab517fdefa6e4f0f569e0bf472a0b309,2026-02-01T21:30:20Z,Tropical Cyclone,στεριά,www.protothema.gr,el,0.9,"Das Meer kam an Land und sie machten eine Bootsfahrt in Fthiotida, siehe Video. „Heute gab es in Glyfa Fthiotida keinen Verkehr, es gab eine Welle“, heißt es in der Überschrift des Videos auf TikTok | TikTok | Fthiotida | Schlechtes Wetter | Griechenland","Η θάλασσα βγήκε στην στεριά και έκαναν βόλτα με βάρκα στη Φθιώτιδα, δείτε βίντεο","«Σήμερα στη Γλύφα Φθιώτιδας δεν είχε κίνηση, είχε κύμα» γράφει η λεζάντα του βίντεο στο TikTok | TikTok | Φθιώτιδα | Κακοκαιρία | Ελλάδα","The sea came ashore and they took a boat ride in Fthiotida, see video. ""Today in Glyfa Fthiotida there was no traffic, there was a wave"" reads the caption of the video on TikTok | TikTok | Fthiotida | Bad weather | Greece","Mare littus accessit^ et arrepta arrepta Fthiotida, vide video. ""Hodie in Glyfa Fthiotida nulla fuit negotiatio, fluctus factus est"" legit caption of the video on TikTok | TikTok | Fthiotida | Bad weather | Graecia",https://www.protothema.gr/greece/article/1766821/i-thalassa-vgike-stin-steria-kai-ekanan-volta-me-varka-sti-fthiotida-deite-video/,https://www.protothema.gr/images/640x360share/jpg/files/2026-02-01/maketa-varka.jpg,,Style Click 55 Piccadilly -,,2026-02-04 13:51:12+00:00,random,,,
7cec2d5d36afdbcfb08f4536485b54e4,2026-02-02 12:00:24,Precipitation,έντονη βροχόπτωση,pelop-gr.cdn.ampproject.org,el,0.9,"Patras: Dymaion-See – Notfallsitzung bei der OLPA zur Bewältigung der Überschwemmung. Wieder einmal verwandelte sich der Dymaion-Strand in Patras aufgrund starker Regenfälle in einen „See“, was zu ernsthaften Verkehrsproblemen führte und noch mehr zunahm",Πάτρα: Λίμνη η Ακτή Δυμαίων - Έκτακτη σύσκεψη στον ΟΛΠΑ για την αντιμετώπιση της πλημμύρας,"Για ακόμη μία φορά, η Ακτή Δυμαίων στην Πάτρα μετατράπηκε σε «λίμνη» εξαιτίας έντονης βροχόπτωσης, προκαλώντας σοβαρά προβλήματα στην κυκλοφορία και αυξημένη","Patras: Dymaion Lake - Emergency meeting at the OLPA to deal with the flood. Once again, Dymaion Beach in Patras turned into a ""lake"" due to heavy rain, causing serious traffic problems and increased","Patras: Lacus Dymaion - Emergency congressus in OLPA ad agendum cum diluvio. Iterum, Dymaion Beach in Patras conversus in ""lacum"" propter pluviam gravem, graves negotiandi difficultates causando et auctus est.",https://pelop-gr.cdn.ampproject.org/v/s/pelop.gr/patra-limni-i-akti-dymaion-ektakti-syskepsi-ston-olpa-gia-tin-antimetopisi-tis-plimmyras/?amp=1&amp_js_v=0.1&amp_gsa=1#webview=1,,,,,2026-02-04 13:51:12+00:00,random,,,
99e21fd1425e096fde9fd1beab5bdc44,2026-02-01T13:51:01Z,Precipitation,βροχόπτωση ελλάδα,www.protothema.gr,el,0.7,"Schlechtes Wetter verwandelte Straßen auf Santorin in Flüsse, siehe Video. Sintflutartige Regenfälle schwemmten Mülltonnen, Äste und andere tragbare Materialien weg und erschwerten den Anwohnern und Besuchern das Reisen | Santorin | Niederschlag | Schlechtes Wetter | Griechenland","Η κακοκαιρία μετέτρεψε σε ποτάμια δρόμους στη Σαντορίνη, δείτε βίντεο","Χείμαρροι παρέσυραν κάδους απορριμμάτων, κλαδιά και άλλα φερτά υλικά, δυσχεραίνοντας σημαντικά τις μετακινήσεις κατοίκων και επισκεπτών | Σαντορίνη | Βροχόπτωση | Κακοκαιρία | Ελλάδα","Bad weather turned roads in Santorini into rivers, see video. Torrential rains swept away trash cans, branches and other portable materials, making it difficult for residents and visitors to travel | Santorini | Precipitation | Bad weather | Greece","Tempestas mala itinera convertit in Santorinis in fluminibus, videre video. Imbres torrentes purgamenta rapuerunt, ramos et alia materia portabilia, difficilem habitantibus et visitatoribus iter facientibus | Santorini | Praecipitatio | Bad weather | Graecia",https://www.protothema.gr/greece/article/1766730/i-kakokairia-metetrepse-se-potamia-dromous-sti-sadorini-deite-video/,https://www.protothema.gr/images/640x360share/jpg/files/2026-02-01/santor.jpg,,"To view this video please enable JavaScript, and consider upgrading to a
 web browser that supports HTML5 video",,2026-02-05 21:06:51+00:00,wmo,Greece,MED,Europe
